{
  "$schema": "../contracts/release-catalog.schema.json",
  "artifacts": [
    {
      "digest": "e8568e26d8762c49c16c9da8372a2e38f746dbaed8c8d29e6e6a7303eedf97f8",
      "id": "capability-catalog",
      "kind": "catalog",
      "sourceId": "oh-my-harness-managed"
    },
    {
      "digest": "2ef1b7aa83d60b968f7733f24302c1625eac5b5faa4d41bf2d6824cf5bd78c41",
      "id": "managed-skills",
      "kind": "managed-skill",
      "sourceId": "oh-my-harness-managed"
    },
    {
      "digest": "c1d0223bec944129b400cd646f7ae16fe2b13ddf6512fa31321a8dccacb2e465",
      "id": "runtime-plugin",
      "kind": "plugin",
      "sourceId": "oh-my-harness-managed"
    }
  ],
  "catalogRevision": "e8568e26d8762c49c16c9da8372a2e38f746dbaed8c8d29e6e6a7303eedf97f8",
  "channel": "stable",
  "compatibility": {
    "maximumCliVersion": "0.3.0",
    "minimumCliVersion": "0.3.0"
  },
  "distribution": {
    "archiveFilename": "oh-my-harness-v0.3.0.tgz",
    "packageName": "oh-my-harness",
    "sidecarFilename": "oh-my-harness-v0.3.0.release.json",
    "tag": "v0.3.0",
    "version": "0.3.0"
  },
  "kind": "release-catalog",
  "schemaVersion": "2.0.0",
  "sequence": 1
}
